{
  "curation_record_version": "1.0",
  "record_id": "cache-ttl-duplicate-with-new-surface",
  "disposition": "duplicate",
  "duplicate_of": "cache-ttl-false-positive",
  "distinct_contribution": "Same conflated-cache misreading as cache-ttl-false-positive, but raised against the *admin-panel* cache constant rather than the client negative-result cache, giving a second, independent affected surface for the same non-finding.",
  "public": {
    "connector_finding": {
      "claim": "A connector flagged, on an unrelated candidate, that the admin panel's cache TTL constant is too short.",
      "connector_identity": "synthetic-connector-alpha"
    },
    "contract_dimension": "correctness",
    "affected_surface": "admin-panel cache TTL constant",
    "adjudication_evidence": "Same non-finding as cache-ttl-false-positive (a short TTL on an intentionally short-lived client-local cache, conflated with an unrelated upstream cache), but raised against a distinct constant and surface, so it is retained as a second surface rather than folded away as a plain duplicate.",
    "provenance": {
      "source_class": "synthetic",
      "source_description": "hand-written synthetic fixture for this ticket's infrastructure proof"
    }
  },
  "private": {
    "provenance": {
      "retention_authority": "repository owner, synthetic-fixture scope only",
      "owner": "review-suite maintainers",
      "review_date": "2026-07-29"
    }
  }
}
